{
  "$schema": "https://json-schema.org/draft/2020-12/schema",
  "$id": "https://operational-evidence-plane.local/schema/tool_permission_packet.v0.schema.json",
  "title": "Operational Evidence Plane Tool Permission Packet v0",
  "description": "Permission decision evidence packet for joining an agent tool call to release manifest, runtime event, trace, and OPA policy decision evidence. The v0.2 release extends this packet with optional replayable permission trace fields (scoped_credential_lifetime, approval_capture, policy_bundle_version, release_manifest_version, model_alias, resolved_model_version, model_provider). The v0.3 release adds optional nd_builtin_cache capture for OPA-style non-deterministic builtin replay. These fields are additive and remain optional so v0.1 records continue to validate; v0.2 and later examples may populate them.",
  "type": "object",
  "additionalProperties": false,
  "required": [
    "schema_version",
    "packet_id",
    "decision_time",
    "release_manifest_id",
    "event_id",
    "tool_call_id",
    "trace_id",
    "span_id",
    "actor",
    "requested_action",
    "tool",
    "resource",
    "policy",
    "decision",
    "links",
    "claim_boundary"
  ],
  "properties": {
    "schema_version": {
      "type": "string",
      "const": "oep.tool_permission_packet.v0"
    },
    "packet_id": {
      "type": "string",
      "pattern": "^pder_[a-z0-9][a-z0-9_-]*$"
    },
    "decision_time": {
      "type": "string",
      "format": "date-time"
    },
    "release_manifest_id": {
      "type": "string",
      "pattern": "^rmf_[a-z0-9][a-z0-9_-]*$"
    },
    "event_id": {
      "type": "string",
      "pattern": "^evt_[a-z0-9][a-z0-9_-]*$"
    },
    "tool_call_id": {
      "type": "string",
      "pattern": "^tool_[a-z0-9][a-z0-9_-]*$"
    },
    "trace_id": {
      "type": "string",
      "pattern": "^[a-f0-9]{32}$"
    },
    "span_id": {
      "type": "string",
      "pattern": "^[a-f0-9]{16}$"
    },
    "actor": {
      "$ref": "#/$defs/actor"
    },
    "requested_action": {
      "$ref": "#/$defs/requested_action"
    },
    "tool": {
      "$ref": "#/$defs/tool"
    },
    "resource": {
      "$ref": "#/$defs/resource"
    },
    "policy": {
      "$ref": "#/$defs/policy_ref"
    },
    "decision": {
      "$ref": "#/$defs/decision"
    },
    "scoped_credential_lifetime": {
      "oneOf": [
        {"type": "null"},
        {
          "type": "string",
          "minLength": 1,
          "description": "ISO 8601 duration describing the time-to-live of the scoped credential used at the call (e.g. PT15M)."
        }
      ]
    },
    "approval_capture": {
      "oneOf": [
        {"type": "null"},
        {"$ref": "#/$defs/approval_capture"}
      ]
    },
    "policy_bundle_version": {
      "oneOf": [
        {"type": "null"},
        {
          "type": "string",
          "pattern": "^sha256:[a-f0-9]{64}$",
          "description": "Hash of the policy bundle in effect at the call. Matches the manifest's policy layer digest."
        }
      ]
    },
    "release_manifest_version": {
      "oneOf": [
        {"type": "null"},
        {
          "type": "string",
          "pattern": "^sha256:[a-f0-9]{64}$",
          "description": "Hash of the release manifest in effect at the call."
        }
      ]
    },
    "model_alias": {
      "oneOf": [
        {"type": "null"},
        {
          "type": "string",
          "minLength": 1,
          "description": "Model alias as called by the agent (e.g. claude-sonnet-4-6). Recording-only field; not a model-quality claim."
        }
      ]
    },
    "resolved_model_version": {
      "oneOf": [
        {"type": "null"},
        {
          "type": "string",
          "minLength": 1,
          "description": "Resolved underlying model version at call time. Recorded so replay records stay stable across silent provider-side model changes."
        }
      ]
    },
    "model_provider": {
      "oneOf": [
        {"type": "null"},
        {
          "type": "string",
          "minLength": 1,
          "description": "Provider of the model (e.g. anthropic, openai, google). Recording-only field; not a vendor endorsement."
        }
      ]
    },
    "nd_builtin_cache": {
      "oneOf": [
        {"type": "null"},
        {"$ref": "#/$defs/nd_builtin_cache"}
      ]
    },
    "links": {
      "$ref": "#/$defs/links"
    },
    "claim_boundary": {
      "type": "string",
      "minLength": 1
    }
  },
  "$defs": {
    "actor": {
      "type": "object",
      "additionalProperties": false,
      "required": ["type", "id", "display_name"],
      "properties": {
        "type": {"type": "string", "enum": ["agent", "tool", "system", "human"]},
        "id": {"type": "string", "minLength": 1},
        "display_name": {"type": "string", "minLength": 1}
      }
    },
    "requested_action": {
      "type": "object",
      "additionalProperties": false,
      "required": ["action_type", "name", "input_ref"],
      "properties": {
        "action_type": {"type": "string", "minLength": 1},
        "name": {"type": "string", "minLength": 1},
        "input_ref": {"type": "string", "minLength": 1}
      }
    },
    "tool": {
      "type": "object",
      "additionalProperties": false,
      "required": ["name", "version", "operation"],
      "properties": {
        "name": {"type": "string", "minLength": 1},
        "version": {"type": "string", "minLength": 1},
        "operation": {"type": "string", "minLength": 1}
      }
    },
    "resource": {
      "type": "object",
      "additionalProperties": false,
      "required": ["type", "id", "uri", "mutable"],
      "properties": {
        "type": {"type": "string", "minLength": 1},
        "id": {"type": "string", "minLength": 1},
        "uri": {"type": "string", "minLength": 1},
        "mutable": {"type": "boolean"}
      }
    },
    "policy_ref": {
      "type": "object",
      "additionalProperties": false,
      "required": ["engine", "package", "policy_id", "policy_version", "policy_uri"],
      "properties": {
        "engine": {"type": "string", "const": "opa"},
        "package": {"type": "string", "minLength": 1},
        "policy_id": {"type": "string", "minLength": 1},
        "policy_version": {"type": "string", "minLength": 1},
        "policy_uri": {"type": "string", "minLength": 1}
      }
    },
    "decision": {
      "type": "object",
      "additionalProperties": false,
      "required": ["allow", "reason", "matched_rule", "opa_result_ref"],
      "properties": {
        "allow": {"type": "boolean"},
        "reason": {"type": "string", "minLength": 1},
        "matched_rule": {"type": "string", "minLength": 1},
        "opa_result_ref": {"type": "string", "minLength": 1}
      }
    },
    "approval_capture": {
      "type": "object",
      "additionalProperties": false,
      "required": ["approver", "captured_at", "approval_type"],
      "properties": {
        "approver": {
          "type": "object",
          "additionalProperties": false,
          "required": ["type", "id", "display_name"],
          "properties": {
            "type": {"type": "string", "enum": ["human", "system"]},
            "id": {"type": "string", "minLength": 1},
            "display_name": {"type": "string", "minLength": 1}
          }
        },
        "captured_at": {"type": "string", "format": "date-time"},
        "approval_type": {"type": "string", "minLength": 1}
      }
    },
    "nd_builtin_cache": {
      "type": "object",
      "description": "OPA non-deterministic builtin cache captured with the original decision record for deterministic replay/debugging. Keys are builtin names such as time.now_ns or http.send; values preserve OPA's input/output mapping payloads without OEP-specific rewriting.",
      "propertyNames": {"type": "string", "minLength": 1},
      "additionalProperties": {
        "type": "object",
        "additionalProperties": true
      }
    },
    "links": {
      "type": "object",
      "additionalProperties": false,
      "required": ["event_ref", "release_manifest_ref", "trace_ref"],
      "properties": {
        "event_ref": {"type": "string", "minLength": 1},
        "release_manifest_ref": {"type": "string", "minLength": 1},
        "trace_ref": {
          "oneOf": [
            {"type": "null"},
            {"type": "string", "minLength": 1}
          ]
        }
      }
    }
  }
}
