{
  "schema_version": "oep.tool_permission_packet.v0",
  "packet_id": "pder_code_review_write_diff_0001",
  "decision_time": "2026-05-04T00:00:03Z",
  "release_manifest_id": "rmf_code_review_agent_2026_05_04_v0",
  "event_id": "evt_code_review_agent_denied_0001",
  "tool_call_id": "tool_write_diff_0001",
  "trace_id": "33333333333333333333333333333333",
  "span_id": "4444444444444444",
  "actor": {
    "type": "agent",
    "id": "agent_code_review_reference_demo",
    "display_name": "code-review-agent-reference-demo"
  },
  "requested_action": {
    "action_type": "write_diff",
    "name": "attempt synthetic repository diff write",
    "input_ref": "demo/fixtures/diff_synthetic_001.patch"
  },
  "tool": {
    "name": "write_diff",
    "version": "0.1.0",
    "operation": "write"
  },
  "resource": {
    "type": "repository_diff",
    "id": "diff_synthetic_001",
    "uri": "demo/fixtures/diff_synthetic_001.patch",
    "mutable": true
  },
  "policy": {
    "engine": "opa",
    "package": "data.oep.permissions",
    "policy_id": "opa-tool-permission-policy",
    "policy_version": "0.1.0",
    "policy_uri": "permissions/policy/tool_permissions.rego"
  },
  "decision": {
    "allow": false,
    "reason": "tool call denied by default reference policy",
    "matched_rule": "deny_by_default",
    "opa_result_ref": "opa eval --data permissions/policy/tool_permissions.rego --input permissions/policy/input/code_review_write_diff.json data.oep.permissions.decision"
  },
  "links": {
    "event_ref": "events/examples/code_review_agent_denied_step.v0.json",
    "release_manifest_ref": "manifest/examples/code_review_agent_release.v0.json",
    "trace_ref": "traces/examples/code_review_agent_denied_trace.v0.json"
  },
  "claim_boundary": "This packet records one denied OPA-backed permission decision for a synthetic reference demo. It is not a policy engine, standard permission format, compliance proof, or production authorization design."
}
