{
  "schema_version": "oep.tool_permission_packet.v0",
  "packet_id": "pder_code_review_read_diff_0001",
  "decision_time": "2026-05-04T00:00:01Z",
  "release_manifest_id": "rmf_code_review_agent_2026_05_04_v0",
  "event_id": "evt_code_review_agent_step_0001",
  "tool_call_id": "tool_read_diff_0001",
  "trace_id": "11111111111111111111111111111111",
  "span_id": "2222222222222222",
  "actor": {
    "type": "agent",
    "id": "agent_code_review_reference_demo",
    "display_name": "code-review-agent-reference-demo"
  },
  "requested_action": {
    "action_type": "inspect_diff",
    "name": "inspect synthetic repository diff",
    "input_ref": "demo/fixtures/diff_synthetic_001.patch"
  },
  "tool": {
    "name": "read_diff",
    "version": "0.1.0",
    "operation": "read"
  },
  "resource": {
    "type": "repository_diff",
    "id": "diff_synthetic_001",
    "uri": "demo/fixtures/diff_synthetic_001.patch",
    "mutable": false
  },
  "policy": {
    "engine": "opa",
    "package": "data.oep.permissions",
    "policy_id": "opa-tool-permission-policy",
    "policy_version": "0.1.0",
    "policy_uri": "permissions/policy/tool_permissions.rego"
  },
  "decision": {
    "allow": true,
    "reason": "reference code review agent may inspect an immutable synthetic diff",
    "matched_rule": "allow_reference_code_review_diff_read",
    "opa_result_ref": "opa eval --data permissions/policy/tool_permissions.rego --input permissions/policy/input/code_review_read_diff.json data.oep.permissions.decision"
  },
  "scoped_credential_lifetime": "PT15M",
  "approval_capture": null,
  "policy_bundle_version": "sha256:e0d5563e9e046960f5435ab1e00f26df8925e16ca7a207ee37df65b7151bcb27",
  "release_manifest_version": "sha256:d9a98ff584ded5701785bc0713ed7fc282f5e3d3adcd8605015e5a21b0f05ba1",
  "model_alias": "deterministic-mock-reviewer",
  "resolved_model_version": "0.1.0",
  "model_provider": "operational-evidence-plane-reference",
  "links": {
    "event_ref": "events/examples/code_review_agent_step.v0.json",
    "release_manifest_ref": "manifest/examples/code_review_agent_release.v0.json",
    "trace_ref": "traces/examples/code_review_agent_trace.v0.json"
  },
  "claim_boundary": "This packet records one OPA-backed permission decision for a synthetic reference demo. The v0.2 fields (scoped_credential_lifetime, approval_capture, policy_bundle_version, release_manifest_version, model_alias, resolved_model_version, model_provider) are record-keeping additions for replayability; they do not create a compliance, audit, or model-quality claim."
}
